{
  "$schema": "http://json-schema.org/draft-07/schema#",
  "$id": "https://cross-c/golden-master-webapp/site-config-0.1.json",
  "title": "Golden Master Webapp Site Config v0.1",
  "description": "Non-secret configuration for one target site. Secrets (Basic-Auth / app-login credentials) live in a sibling .env file, never in this file.",
  "type": "object",
  "required": ["id", "displayName", "baseUrl"],
  "properties": {
    "id": {
      "type": "string",
      "description": "URL-safe unique identifier, matches the sites/<id> directory name.",
      "pattern": "^[a-zA-Z0-9_-]+$"
    },
    "displayName": {
      "type": "string",
      "description": "Human-readable name shown in the UI."
    },
    "baseUrl": {
      "type": "string",
      "description": "Seed URL the crawler starts from.",
      "format": "uri"
    },
    "folder": {
      "type": "string",
      "description": "Optional group name for organizing sites/test cases in the UI (e.g. \"customer-portal\", \"admin\")."
    },
    "labels": {
      "type": "array",
      "description": "Free-form tags for filtering sites/test cases in the UI (e.g. [\"smoke\", \"nightly\"]).",
      "items": { "type": "string" },
      "default": []
    },
    "ruleSpecDir": {
      "type": "string",
      "description": "Path (relative to this site's directory) holding Rule Spec YAML/JSON files.",
      "default": "rule-spec"
    },
    "manualFormsPath": {
      "type": "string",
      "description": "Path (relative to this site's directory) to a hand-authored forms.json-shaped file (array of ScannedForm objects, each optionally with a `preSteps` array). When set, this replaces the crawler's live form detection as the source of form definitions fed into semantic inference / pairwise generation / codegen — use this for pages where fields only appear after a wizard-style interaction (e.g. selecting a radio button) that the generic crawler can't discover on its own."
    },
    "outputDir": {
      "type": "string",
      "description": "Path (relative to this site's directory) where crawl/test-case sessions are written.",
      "default": ".golden-master"
    },
    "crawl": {
      "type": "object",
      "properties": {
        "maxDepth": { "type": "integer", "minimum": 0, "default": 3 },
        "maxPages": { "type": "integer", "minimum": 1, "default": 30 },
        "maxCasesPerForm": { "type": "integer", "minimum": 1, "default": 25 },
        "normalOnlyPairwise": { "type": "boolean", "default": false },
        "dryRun": { "type": "boolean", "default": false },
        "headful": { "type": "boolean", "default": false },
        "fastFail": { "type": "boolean", "default": true },
        "successCheckpoint": {
          "type": "string",
          "description": "url:/selector:/text: prefixed string marking success without needing an error-free page."
        }
      },
      "additionalProperties": false
    },
    "login": {
      "type": "object",
      "description": "Non-secret application-login hints. Credentials go in .env as LOGIN_USER / LOGIN_PASS.",
      "properties": {
        "loginUrl": { "type": "string", "format": "uri" },
        "usernameSelector": { "type": "string" },
        "passwordSelector": { "type": "string" },
        "submitSelector": { "type": "string" }
      },
      "additionalProperties": false
    },
    "browser": {
      "type": "object",
      "description": "Browser engine, device emulation, and client-certificate settings for crawling/test execution.",
      "properties": {
        "engine": {
          "type": "string",
          "enum": ["chromium", "firefox", "webkit"],
          "default": "chromium"
        },
        "device": {
          "type": "string",
          "description": "Playwright device descriptor name for viewport/UA emulation (e.g. \"iPhone 14\", \"Pixel 7\"). See Playwright's `devices` registry for valid names."
        },
        "clientCert": {
          "type": "object",
          "description": "Non-secret client-certificate paths (relative to this site's directory). The passphrase, if any, goes in .env as SECRET_CLIENT_CERT_PASSPHRASE.",
          "properties": {
            "origin": { "type": "string", "description": "Origin the certificate applies to, e.g. \"https://example.com\"." },
            "certPath": { "type": "string" },
            "keyPath": { "type": "string" }
          },
          "additionalProperties": false
        }
      },
      "additionalProperties": false
    },
    "ai": {
      "type": "object",
      "description": "Opt-in AI-assisted scenario assertions (the aiAssert step). Off by default — unlike every other step type, aiAssert shells out to the local Claude Code CLI per assertion, so it must be explicitly enabled here.",
      "properties": {
        "assertionsEnabled": { "type": "boolean", "default": false },
        "locale": { "type": "string", "enum": ["ja", "en", "fr"], "default": "ja" }
      },
      "additionalProperties": false
    },
    "basicAuth": {
      "type": "object",
      "description": "Flags that Basic-Auth is used. Credentials go in .env as BASIC_USER / BASIC_PASS.",
      "properties": {
        "enabled": { "type": "boolean", "default": false }
      },
      "additionalProperties": false
    },
    "variables": {
      "type": "object",
      "description": "Standard (non-secret) named values usable as {{NAME}} tokens inside scenario step url/selector/value fields. Secret variables are never stored here — set them via .env as SECRET_<NAME>=value instead.",
      "additionalProperties": { "type": "string" },
      "default": {}
    },
    "scenario": {
      "type": "object",
      "description": "Reusable browser steps run before crawling/test execution (see core/scenario/siteScenario.js). `login` credentials live in .env.",
      "properties": {
        "steps": {
          "type": "array",
          "description": "Steps may reference a shared step group via { action: 'useSharedStep', name }, see sites/<id>/shared-steps.json."
        },
        "dataSource": {
          "type": "string",
          "description": "Name of a CSV file under sites/<id>/data/<name>.csv; when set, the scenario runs once per row for data-driven testing, with each row's columns available as {{COLUMN}} variables."
        }
      },
      "additionalProperties": false
    },
    "scenarioExpansion": {
      "type": "array",
      "description": "Declarative, site-config-driven test-case expansion. Generalizes the idea of 'when this URL and trigger selector are both present, synthesize N extra scenario test cases from templates' without any hardcoded per-site logic in the runner.",
      "items": {
        "type": "object",
        "required": ["urlPattern", "triggerSelector", "templates"],
        "properties": {
          "urlPattern": {
            "type": "string",
            "description": "Regex (string form) matched against the scanned form's URL."
          },
          "triggerSelector": {
            "type": "string",
            "description": "CSS selector that must exist among the scanned form's fields for this expansion to apply."
          },
          "templates": {
            "type": "array",
            "description": "Each template describes one extra generated test case as a set of selector -> value overrides applied on top of the form's normal-value baseline.",
            "items": {
              "type": "object",
              "required": ["name", "overrides"],
              "properties": {
                "name": { "type": "string" },
                "overrides": {
                  "type": "object",
                  "description": "selector -> literal value string to assign for this template.",
                  "additionalProperties": { "type": "string" }
                }
              },
              "additionalProperties": false
            }
          }
        },
        "additionalProperties": false
      },
      "default": []
    }
  },
  "additionalProperties": false
}
